Sheet: yor
A1: tipo | B1: cod | C1: img | D1: prod | E1: ean | F1: peso | G1: val | H1: qtd_uni | I1: qtd_ped | J1: ncm | K1: cest | L1: icms | M1: iva | N1: vl_uni | O1: vl_uni_st | P1: vl_disp | Q1: vl_disp_st | R1: vl_min | S1: vl_min_st
A2: 1 | B2: BTB001 | C2: ../empresas/yor/img/beantobar-barra.png | D2: Yör Chocolates Tablete de Chocolate Bean to Bar Ao Leite 44% cacau Faz Leolinda 75g | E2: 7898691280008 | F2: 75 | G2: 365 | H2: 12 | I2: 72 | J2: 1806.32.10 | K2: 17.003.00 | L2: 18 | M2: 50.2 | N2: 9.4 | O2: 10.249384000000001 | P2: =RC[-2]*12 -> 112.80000000000001 | Q2: =RC[-2]*12 -> 122.99260800000002 | R2: =RC[-4]*RC[-9] -> 676.80000000000007 | S2: =RC[-4]*RC[-10] -> 737.95564800000011
A3: 2 | B3: Regionais001 | C3: ../empresas/yor/img/regionais-barra.png | D3: Yör Chocolates Tablete de Chocolate Regionais Branco com Doce de Leite 75g | E3: 7898691280022 | F3: 75 | G3: 365 | H3: 12 | I3: 72 | J3: 1704.90.10 | K3: 17.001.00 | L3: 18 | M3: 49.61 | N3: 9.4088119137279236 | O3: 10.248999999999999 | P3: =RC[-2]*12 -> 112.90574296473508 | Q3: =RC[-2]*12 -> 122.98799999999999 | R3: =RC[-4]*RC[-9] -> 677.43445778841055 | S3: =RC[-4]*RC[-10] -> 737.92799999999988
A4: 3 | B4: Origens001 | C4: ../empresas/yor/img/origens-barra.png | D4: Yör Chocolates Tablete de Chocolate Origens 70% cacau Blend Cacau do Brasil 75g | E4: 7898691280015 | F4: 75 | G4: 365 | H4: 12 | I4: 72 | J4: 1806.32.10 | K4: 17.003.00 | L4: 18 | M4: 50.2 | N4: 9.4 | O4: 10.249384000000001 | P4: =RC[-2]*12 -> 112.80000000000001 | Q4: =RC[-2]*12 -> 122.99260800000002 | R4: =RC[-4]*RC[-9] -> 676.80000000000007 | S4: =RC[-4]*RC[-10] -> 737.95564800000011
A5: 4 | B5: Sabores001 | C5: ../empresas/yor/img/sabores-barra.png | D5: Yör Chocolates Tablete de Chocolate Sabores 65% cacau com Café Faz Recanto 75g | E5: 7898691280039 | F5: 75 | G5: 365 | H5: 12 | I5: 72 | J5: 1806.32.10 | K5: 17.003.00 | L5: 18 | M5: 50.2 | N5: 9.4 | O5: 10.249384000000001 | P5: =RC[-2]*12 -> 112.80000000000001 | Q5: =RC[-2]*12 -> 122.99260800000002 | R5: =RC[-4]*RC[-9] -> 676.80000000000007 | S5: =RC[-4]*RC[-10] -> 737.95564800000011